{
  "protocolVersion": "0.1.0",
  "id": "xiazhi",
  "slug": "xiazhi",
  "name": "夏至",
  "name_en": "Summer Solstice",
  "season": "summer",
  "order": 10,
  "version": "0.1.0",
  "status": "In Development",
  "entry": "src/index.ts",
  "capabilities": [
    "static"
  ],
  "content": "content/zh-CN.json",
  "assets": "assets/manifest.json",
  "references": "references.json",
  "locales": [
    "zh-CN"
  ]
}