{
  "protocolVersion": "0.1.0",
  "id": "qiufen",
  "slug": "qiufen",
  "name": "秋分",
  "name_en": "Autumn Equinox",
  "season": "autumn",
  "order": 16,
  "version": "0.1.0",
  "status": "In Development",
  "entry": "src/index.ts",
  "capabilities": [
    "static"
  ],
  "content": "content/zh-CN.json",
  "assets": "assets/manifest.json",
  "references": "references.json",
  "locales": [
    "zh-CN"
  ]
}