{
  "protocolVersion": "0.1.0",
  "id": "qingming",
  "slug": "qingming",
  "name": "清明",
  "name_en": "Clear and Bright",
  "season": "spring",
  "order": 5,
  "version": "0.1.0",
  "status": "In Development",
  "entry": "src/index.ts",
  "capabilities": [
    "static"
  ],
  "content": "content/zh-CN.json",
  "assets": "assets/manifest.json",
  "references": "references.json",
  "locales": [
    "zh-CN"
  ]
}